02-21 22:27:13 D/ConfigurationFactory: Searching the 'config/' config path
==================
Notice:
We collect anonymous usage statistics in accordance with our Content Licenses (https://source.android.com/setup/start/licenses), Contributor License Agreement (https://opensource.google.com/docs/cla/), Privacy Policy (https://policies.google.com/privacy) and Terms of Service (https://policies.google.com/terms).
==================
02-21 22:27:13 D/TradefedFeatureServer: Starting feature server.
02-21 22:27:13 D/GlobalConfiguration: Resolve and remote files from @Option
Android Compatibility Test Suite 14_r7 (13033356)
Use "help" or "help all" to get more information on running commands.
Non-interactive mode: Running initial command then exiting.
Using commandline arguments as starting command: [run, commandAndExit, cts, -m, CtsDisplayTestCases, -t, android.display.cts.DisplayTest#testGetSupportedModesOnDefaultDisplay, -s, 27161FDH20031X]
02-21 22:27:13 I/DeviceManager: Detected new device 2B231FDH200B4Z
02-21 22:27:13 I/TradefedInvocationAgent: Runtime info file path: /tmp/olc_server_gen_files/session_88953b84-7cda-453c-b9f3-44f3766cf21f/job_gen_xts-tradefed-test-job_d4cda9cc-9af3-499c-a357-1c87c927a055/test_e01776a1-47c3-49f2-ac76-7b8b0561b038/tf_runtime_info
02-21 22:27:13 I/DeviceManager: Detected new device 27161FDH20031X
02-21 22:27:13 I/CommandScheduler: Received shutdown request.
02-21 22:27:14 I/TestInvocation: Starting invocation for 'cts' with '[ DeviceBuildInfo{bid=13033356, serial=27161FDH20031X} on device '27161FDH20031X'] 
02-21 22:27:19 E/WifiCheck: Device has no network connection, no ssid provided, some modules of CTS require an active network connection
02-21 22:27:36 W/ApkInstrumentationPreparer: Target preparation step com.android.compatibility.common.deviceinfo.KeystoreAttestationDeviceInfo#testCollectDeviceInfo failed.
junit.framework.AssertionFailedError: KeystoreAttestationDeviceInfo collection completed. expected:<COMPLETED> but was:<FAILED>
	at junit.framework.Assert.fail(Assert.java:50)
	at junit.framework.Assert.failNotEquals(Assert.java:287)
	at junit.framework.Assert.assertEquals(Assert.java:67)
	at com.android.compatibility.common.deviceinfo.DeviceInfo.testCollectDeviceInfo(DeviceInfo.java:112)
	at java.lang.reflect.Method.invoke(Native Method)
	at android.test.InstrumentationTestCase.runMethod(InstrumentationTestCase.java:220)
	at android.test.InstrumentationTestCase.runTest(InstrumentationTestCase.java:205)
02-21 22:27:37 W/PropertyCheck: Expected "user" but found "userdebug" for property: ro.build.type
02-21 22:27:37 W/PropertyCheck: Property "persist.sys.test_harness" not found on device, cannot verify value "false" 
02-21 22:27:38 D/ITestSuite: [Total Unique Modules = 2]
02-21 22:27:38 I/ITestSuite: 27161FDH20031X running 2 modules: [arm64-v8a CtsDisplayTestCases[instant], arm64-v8a CtsDisplayTestCases]
02-21 22:27:39 D/ModuleDefinition: Running module arm64-v8a CtsDisplayTestCases[instant]
02-21 22:27:43 I/ModuleListener: [1/1] 27161FDH20031X android.display.cts.DisplayTest#testGetSupportedModesOnDefaultDisplay FAILURE: java.lang.AssertionError: Expected {id=1, width=1080, height=2400, fps=60.0, vsync=60.0, alternativeRefreshRates=[90.0], supportedHdrTypes=[2, 3, 4]} to be listed as alternative refresh rate of {id=2, width=1080, height=2400, fps=90.0, vsync=90.0, alternativeRefreshRates=[], supportedHdrTypes=[2, 3, 4]}. All supported modes are [{id=1, width=1080, height=2400, fps=60.0, vsync=60.0, alternativeRefreshRates=[90.0], supportedHdrTypes=[2, 3, 4]}, {id=2, width=1080, height=2400, fps=90.0, vsync=90.0, alternativeRefreshRates=[], supportedHdrTypes=[2, 3, 4]}]
	at org.junit.Assert.fail(Assert.java:89)
	at org.junit.Assert.assertTrue(Assert.java:42)
	at android.display.cts.DisplayTest.testGetSupportedModesOnDefaultDisplay(DisplayTest.java:881)
02-21 22:27:45 I/MonitoringUtils: Wifi Connectivity check failed on 27161FDH20031X. (Is your device connected to Wifi?), retrying in 5000ms
02-21 22:27:51 I/MonitoringUtils: Wifi Connectivity check failed on 27161FDH20031X. (Is your device connected to Wifi?), retrying in 5000ms
02-21 22:27:57 I/MonitoringUtils: Wifi Connectivity check failed on 27161FDH20031X. (Is your device connected to Wifi?), retrying in 5000ms
02-21 22:28:03 I/MonitoringUtils: Wifi Connectivity check failed on 27161FDH20031X. (Is your device connected to Wifi?), retrying in 5000ms
02-21 22:28:08 W/ITestSuite: System status checker [com.android.compatibility.common.tradefed.targetprep.NetworkConnectivityChecker] failed
02-21 22:28:08 E/LeakedThreadStatusChecker: We have 4 threads instead of 1. List: [Thread[Invocation-27161FDH20031X,5,Invocation-27161FDH20031X], Thread[BackgroundDeviceAction-logcat -b all -v threadtime,uid,5,Invocation-27161FDH20031X], Thread[Timer-1,5,Invocation-27161FDH20031X], Thread[grpc-default-worker-ELG-3-1,5,Invocation-27161FDH20031X]]
02-21 22:28:08 W/ITestSuite: System status checker [com.android.tradefed.suite.checker.LeakedThreadStatusChecker] failed
02-21 22:28:09 W/DeviceSettingChecker: Setting in namespace global fails:
 ota_disable_automatic_update is not found before module run
02-21 22:28:09 W/ITestSuite: System status checker [com.android.tradefed.suite.checker.DeviceSettingChecker] failed
02-21 22:28:09 W/ITestSuite: There are failed system status checkers: {com.android.compatibility.common.tradefed.targetprep.NetworkConnectivityChecker=, com.android.tradefed.suite.checker.LeakedThreadStatusChecker=We have 4 threads instead of 1. List: [Thread[Invocation-27161FDH20031X,5,Invocation-27161FDH20031X], Thread[BackgroundDeviceAction-logcat -b all -v threadtime,uid,5,Invocation-27161FDH20031X], Thread[Timer-1,5,Invocation-27161FDH20031X], Thread[grpc-default-worker-ELG-3-1,5,Invocation-27161FDH20031X]], com.android.tradefed.suite.checker.DeviceSettingChecker=Setting in namespace global fails:
 ota_disable_automatic_update is not found before module run
}
02-21 22:28:10 D/ModuleDefinition: Running module arm64-v8a CtsDisplayTestCases
02-21 22:28:16 I/ModuleListener: [1/1] 27161FDH20031X android.display.cts.DisplayTest#testGetSupportedModesOnDefaultDisplay FAILURE: java.lang.AssertionError: Expected {id=1, width=1080, height=2400, fps=60.0, vsync=60.0, alternativeRefreshRates=[90.0], supportedHdrTypes=[2, 3, 4]} to be listed as alternative refresh rate of {id=5, width=1080, height=2400, fps=90.0, vsync=90.0, alternativeRefreshRates=[], supportedHdrTypes=[2, 3, 4]}. All supported modes are [{id=1, width=1080, height=2400, fps=60.0, vsync=60.0, alternativeRefreshRates=[90.0], supportedHdrTypes=[2, 3, 4]}, {id=5, width=1080, height=2400, fps=90.0, vsync=90.0, alternativeRefreshRates=[], supportedHdrTypes=[2, 3, 4]}]
	at org.junit.Assert.fail(Assert.java:89)
	at org.junit.Assert.assertTrue(Assert.java:42)
	at android.display.cts.DisplayTest.testGetSupportedModesOnDefaultDisplay(DisplayTest.java:881)
02-21 22:28:18 I/MonitoringUtils: Wifi Connectivity check failed on 27161FDH20031X. (Is your device connected to Wifi?), retrying in 5000ms
02-21 22:28:24 I/MonitoringUtils: Wifi Connectivity check failed on 27161FDH20031X. (Is your device connected to Wifi?), retrying in 5000ms
02-21 22:28:30 I/MonitoringUtils: Wifi Connectivity check failed on 27161FDH20031X. (Is your device connected to Wifi?), retrying in 5000ms
02-21 22:28:36 I/MonitoringUtils: Wifi Connectivity check failed on 27161FDH20031X. (Is your device connected to Wifi?), retrying in 5000ms
02-21 22:28:41 W/NetworkConnectivityChecker: NetworkConnectivityChecker is still failing on 27161FDH20031X.
02-21 22:28:41 E/LeakedThreadStatusChecker: We have 4 threads instead of 1. List: [Thread[Invocation-27161FDH20031X,5,Invocation-27161FDH20031X], Thread[BackgroundDeviceAction-logcat -b all -v threadtime,uid,5,Invocation-27161FDH20031X], Thread[Timer-1,5,Invocation-27161FDH20031X], Thread[grpc-default-worker-ELG-3-1,5,Invocation-27161FDH20031X]]
02-21 22:28:41 W/ITestSuite: System status checker [com.android.tradefed.suite.checker.LeakedThreadStatusChecker] failed
02-21 22:28:42 W/ITestSuite: There are failed system status checkers: {com.android.tradefed.suite.checker.LeakedThreadStatusChecker=We have 4 threads instead of 1. List: [Thread[Invocation-27161FDH20031X,5,Invocation-27161FDH20031X], Thread[BackgroundDeviceAction-logcat -b all -v threadtime,uid,5,Invocation-27161FDH20031X], Thread[Timer-1,5,Invocation-27161FDH20031X], Thread[grpc-default-worker-ELG-3-1,5,Invocation-27161FDH20031X]]}
02-21 22:28:43 E/NativeDevice: Device path /sdcard/report-log-files/ does not exist to be pulled.
02-21 22:28:43 W/NativeDevice: Attempting to stop logcat when not capturing for 27161FDH20031X
02-21 22:28:43 I/SuiteResultReporter: 
============================================
================= Results ==================
=============== Consumed Time ==============
    arm64-v8a CtsDisplayTestCases: 4s
    arm64-v8a CtsDisplayTestCases[instant]: 2s
Total aggregated tests run time: 6s
============== Modules Preparation Times ==============
    arm64-v8a CtsDisplayTestCases[instant] => prep = 2087 ms || clean = 569 ms
    arm64-v8a CtsDisplayTestCases => prep = 2197 ms || clean = 518 ms
Total preparation time: 4s  ||  Total tear down time: 1s
=======================================================
=============== Summary ===============
Total Run time: 1m 29s
2/2 modules completed
Total Tests       : 2
PASSED            : 0
FAILED            : 2
============== End of Results ==============
============================================
02-21 22:28:43 D/ProtoResultReporter: process final logs: /tmp/13033356/cts/inv_15454223322656281612/inv_4644924509951553189/end_host_log_16701631635262191121.txt
02-21 22:28:43 I/CommandScheduler: Updating command 1 with elapsed time 89681 ms
02-21 22:28:43 E/CommandScheduler: Stray thread detected for command 1, [cts, -m, CtsDisplayTestCases, -t, android.display.cts.DisplayTest#testGetSupportedModesOnDefaultDisplay, -s, 27161FDH20031X]. 2 threads instead of 1
02-21 22:28:43 E/CommandScheduler: List of remaining threads: [Thread[Invocation-27161FDH20031X,5,Invocation-27161FDH20031X], Thread[grpc-default-worker-ELG-3-1,5,Invocation-27161FDH20031X]]
02-21 22:28:43 I/CommandScheduler: Waiting for invocation threads to complete
02-21 22:28:43 I/CommandScheduler: Finalizing the logger and invocation.
02-21 22:28:43 D/ActiveTrace: Finalizing trace: /tmp/invocation-trace6088515312456133857.perfetto-trace
We have 2 threads instead of 1: [Thread[Invocation-27161FDH20031X,5,Invocation-27161FDH20031X], Thread[grpc-default-worker-ELG-3-1,5,Invocation-27161FDH20031X]]. Check the logs for list of threads.
02-21 22:28:43 D/ProtoResultReporter: process final logs: /tmp/13033356/cts/inv_15454223322656281612/inv_4644924509951553189/invocation-trace_17726839333421235552.perfetto-trace.gz
02-21 22:28:43 D/ProtoResultReporter: process final logs: /tmp/13033356/cts/inv_15454223322656281612/inv_4644924509951553189/invoc_complete_host_log_15992941571157089398.txt
02-21 22:28:43 V/LogRegistry: Saved log to /tmp/tradefed_global_log_7691297044369976208.txt
02-21 22:28:43 I/CommandScheduler: All done
